{
  "$schema": "https://json-schema.org/draft-07/schema#",
  "$id": "https://oh-my-tradeagent/schemas/order-intent.json",
  "title": "OrderIntent",
  "description": "Workflow→exec-svc request to place a paper or live broker order. Generated by CopytradeSignalWorkflow after risk+contract gates pass and consumed by ExecActivities.placeOrder on the broker-<env> task queue. intent_key drives the 3-layer idempotency model (plan line 362).",
  "type": "object",
  "javaType": "com.ohmytradeagent.contract.OrderIntent",
  "additionalProperties": false,
  "required": [
    "schema_version",
    "tenant_id",
    "strategy_id",
    "intent_key",
    "signal_id",
    "broker_target",
    "option_symbol",
    "side",
    "qty",
    "recorded_at"
  ],
  "properties": {
    "schema_version": {
      "type": "integer",
      "minimum": 1,
      "description": "DTO contract version. Workers reject newer-than-build inputs to force redeploy."
    },
    "tenant_id": {
      "type": "string",
      "minLength": 1
    },
    "strategy_id": {
      "type": "string",
      "minLength": 1
    },
    "intent_key": {
      "type": "string",
      "minLength": 1,
      "description": "Internal deterministic idempotency key (journal PK). Shape: '<workflow_id>:entry' or '<workflow_id>:exit:<exit_signal_id>'. The broker-facing client_order_id is NOT this value verbatim: per #295 it is a bounded (<=128-char) SHA-256-derived id deterministically computed from — and distinct from — this intent_key, since a real exit intent_key can exceed Alpaca's 128-char client_order_id cap."
    },
    "signal_id": {
      "type": "string",
      "minLength": 1,
      "description": "Source Discord signal_id (correlates to CopytradeSignalPayload.signal_id and the audit-log correlation_id)."
    },
    "broker_target": {
      "type": "string",
      "enum": [
        "paper",
        "live",
        "alpaca-paper",
        "alpaca-live",
        "tradier-paper",
        "tradier-live",
        "ibkr-paper",
        "ibkr-live",
        "schwab-paper",
        "schwab-live"
      ],
      "description": "Routes the activity to the broker-<value> task queue. Phase 2c.2 introduced the <provider>-<env> shape (e.g. alpaca-paper). The legacy bare paper/live values are admitted ONLY for deserialization of pre-2c.2 audit records; using them for active routing produces a non-retryable InvalidBrokerTargetError because no worker polls broker-paper / broker-live."
    },
    "option_symbol": {
      "type": "string",
      "minLength": 1,
      "description": "Full OCC option symbol (e.g. 'AAPL250117C00150000'), resolved by ContractActivities.resolve from CopytradeSignalPayload.(ticker, expiry, strike, right). Distinct from the raw underlying ticker carried on the upstream signal payload."
    },
    "side": {
      "type": "string",
      "enum": ["BUY", "SELL"],
      "description": "BUY=BTO; SELL=STC. Phase 2b only exercises BUY."
    },
    "qty": {
      "type": "integer",
      "minimum": 1,
      "description": "Number of contracts (after capital-weight clamp)."
    },
    "limit_price": {
      "type": "number",
      "exclusiveMinimum": 0,
      "description": "Optional limit. Omitted (null) means marketable-mid. Phase 2b passes payload.price."
    },
    "recorded_at": {
      "type": "string",
      "format": "date-time",
      "description": "Workflow's view of when the intent was minted (UTC)."
    }
  }
}
